<?xml version="1.0" encoding="UTF-8"?>


<root
    xmlns:xsi='http://www.w3.org/2001/XMLSchema-instance'
    xmlns='http://luoying.huliqing.name'
    xsi:schemaLocation='http://luoying.huliqing.name meta/action.xsd'>

    <!--==========================================================================-->
    <!-- 基本配置 -->
    <!--==========================================================================-->
    
    <!--战斗行为基本配置-->
    <actionDynamicFight id="actionFightBase" allowFollow="1" autoFacing="1" fightSkillTypes="fight,attack" attackIntervalAttribute="attributeGhostRate" />
    
    <!--==========================================================================-->
    <!-- 其它配置 -->
    <!--==========================================================================-->
    
    <!--普通动态角色的战斗行为，会跟随，会转向，如：人物，怪物，能移动的武器-->
    <actionDynamicFight id="actionDynamicFight" extends="actionFightBase" autoTakeOffWeapon="1" />
    
    <!--静止角色的战斗行为，不会动，不会转向，如静止炮塔-->
    <actionDynamicFight id="actionStaticFight" extends="actionFightBase" allowFollow="0" autoFacing="0" />
    
    <!--静止角色的空闲行为,不能移动-->
    <actionStaticIdle id="actionStaticIdle" />
    <actionDynamicIdle id="actionDynamicIdle" />
    <!--巡逻行为，会在一个地点来回走动。-->
    <actionPatrolIdle id="actionPatrolIdle" />
    
    <!--移动行为,包含有寻路,避障功能-->
    <actionPathRun id="actionRun" />
    <!--简单的移动行为，走直线，无寻路，只有简单的避障功能-->
    <actionSimpleRun id="actionSimpleRun" />
    
    <!--简单的跟随行为-->
    <actionPathFollow id="actionFollow" autoFacing="1" />
    
</root>



